{
  "schema_version": 1,
  "kind": "bootstrap_work_item",
  "id": "BOOT-01",
  "title": "Engineering Master Plan",
  "status": "DONE",
  "objective": "Define the permanent Development Engine roadmap before implementing it.",
  "depends_on": [
    "BOOT-00"
  ],
  "allowed_paths": [
    "AGENTS.md",
    "engineering/**",
    "scripts/governance/**",
    ".github/workflows/engineering-bootstrap.yml"
  ],
  "forbidden_scope": [
    "business source changes",
    "Lot45 candidate changes",
    "Lot46 implementation",
    "frozen historical evidence mutation",
    "mandatory paid or LLM-backed dependency"
  ],
  "tasks": [
    {
      "id": "BOOT-01.1",
      "status": "DONE",
      "description": "Define security, performance and zero-cost principles."
    },
    {
      "id": "BOOT-01.2",
      "status": "DONE",
      "description": "Define ENG-00 through ENG-09."
    },
    {
      "id": "BOOT-01.3",
      "status": "DONE",
      "description": "Subdivide every ENG lot into major sub-lots."
    },
    {
      "id": "BOOT-01.4",
      "status": "DONE",
      "description": "Define target validation tiers and business unlock boundary."
    }
  ],
  "done_when": [
    "master plan exists",
    "all permanent engine phases have ordered objectives and major sub-lots"
  ]
}
